{
    "id": "rover-coin",
    "symbol": "roe",
    "name": "Rover Coin",
    "platforms": {},
    "hashing_algorithm": "X11",
    "categories": [
        "Cryptocurrency",
        "Masternodes"
    ],
    "description": {
        "en": "Rover Coin (ROE), is an open-source, peer-to-peer, digital currency, designed and engineered for maximizing decentralization, opportunities for earnings, diversified network and hybrid systems. Rover Coin is a PoS/Masternode based cryptocurrency that provides a secure purchase experience in gaming industry. It\u2019s a hybrid coin that provides reward for Proof of staking, Masternodes and for Proof of Work as well.\r\n\r\nThe RoverCoin PoS method of work based on BlackCoin 2.0 PoS protocol with fixed PoS rewards per block. With the PoS 2.0 protocol possible attack vectors are reduced to a minimum and the incentive to support the network by having a full node running continuously is clearly increased. This will allow RoverCoin and PoS to continue to scale for mass adoption while plugging and mitigating potential risks. \r\n\r\nRover  Coin is an altcoin introduced to give unique instant payment Solution for Payments related to Gaming Sector. Rover Coin will also help you the Gamers to be Anonymous.\r\n\r\nRoadmap: http://rovercoin.io/#roadmap"
    },
    "country_origin": "",
    "genesis_date": null,
    "url": "http://rovercoin.io/",
    "explorers": [],
    "twitter": "rovercoinroe",
    "facebook": "RoverCoin",
    "github_org": "RoverCoin"
}